[{"browser_owner":{"cdp_port":9324,"profile":"~/.cloak/profiles/affiliate/en"},"cadence":{"keep_alive":true},"cleanup":{"max_age_days":14,"max_runs":100},"domain":"growth","effect_class":"none","entrypoint":"runtime/loop/entry_dispatch.py","label":"ai.anicca.affiliate-browser","log_root":"~/.local/state/life-manager/affiliate-browser/logs","loop_id":"affiliate-browser","provider_route":"shared-agent-runner","state_root":"~/.local/state/life-manager/affiliate-browser"},{"cadence":{"start_interval_seconds":600},"cleanup":{"max_age_days":14,"max_runs":100},"domain":"growth","effect_class":"none","entrypoint":"runtime/loop/entry_dispatch.py","label":"ai.anicca.affiliate-composition","log_root":"~/.local/state/life-manager/affiliate-composition/logs","loop_id":"affiliate-composition","provider_route":"deterministic","state_root":"~/.local/state/life-manager/affiliate-composition"},{"browser_owner":{"cdp_port":9327,"profile":"~/.cloak/profiles/affiliate/impact-en"},"cadence":{"keep_alive":true},"cleanup":{"max_age_days":14,"max_runs":100},"domain":"growth","effect_class":"none","entrypoint":"runtime/loop/entry_dispatch.py","label":"ai.anicca.affiliate-impact-browser","log_root":"~/.local/state/life-manager/affiliate-impact-browser/logs","loop_id":"affiliate-impact-browser","provider_route":"shared-agent-runner","state_root":"~/.local/state/life-manager/affiliate-impact-browser"},{"cadence":{"start_interval_seconds":600},"cleanup":{"max_age_days":14,"max_runs":100},"domain":"growth","effect_class":"publish","entrypoint":"runtime/loop/entry_dispatch.py","label":"ai.anicca.affiliate-loop","log_root":"~/.local/state/life-manager/affiliate-loop/logs","loop_id":"affiliate-loop","provider_route":"deterministic","state_root":"~/.local/state/life-manager/affiliate-loop"},{"cadence":{"start_interval_seconds":600},"cleanup":{"max_age_days":14,"max_runs":100},"domain":"growth","effect_class":"none","entrypoint":"runtime/loop/entry_dispatch.py","label":"ai.anicca.affiliate-source-refresh","log_root":"~/.local/state/life-manager/affiliate-source-refresh/logs","loop_id":"affiliate-source-refresh","provider_route":"deterministic","state_root":"~/.local/state/life-manager/affiliate-source-refresh"},{"browser_owner":{"cdp_port":9326,"profile":"~/.cloak/profiles/affiliate/x-en"},"cadence":{"keep_alive":true},"cleanup":{"max_age_days":14,"max_runs":100},"domain":"growth","effect_class":"none","entrypoint":"runtime/loop/entry_dispatch.py","label":"ai.anicca.affiliate-x-browser","log_root":"~/.local/state/life-manager/affiliate-x-browser/logs","loop_id":"affiliate-x-browser","provider_route":"shared-agent-runner","state_root":"~/.local/state/life-manager/affiliate-x-browser"},{"cadence":{"keep_alive":true},"cleanup":{"max_age_days":14,"max_runs":100},"domain":"financial","effect_class":"none","entrypoint":"skills/agent-economy/launch.sh","label":"ai.anicca.agent-economy-loop","log_root":"~/.openclaw/logs","loop_id":"agent-economy-loop","provider_route":"shared-agent-runner","state_root":"~/.openclaw"},{"cadence":{"calendar_interval":{"Hour":9,"Minute":0}},"cleanup":{"max_age_days":14,"max_runs":100},"domain":"earn","effect_class":"message","entrypoint":"runtime/agentmail/nudge-tick.sh","label":"ai.anicca.agentmail-nudge","log_root":"~/.openclaw/logs","loop_id":"agentmail-nudge","provider_route":"shared-agent-runner","state_root":"~/.openclaw"},{"cadence":{"start_interval_seconds":21600},"cleanup":{"max_age_days":14,"max_runs":100},"domain":"earn","effect_class":"message","entrypoint":"runtime/agentmail/replier-tick.sh","label":"ai.anicca.agentmail-replier","log_root":"~/.openclaw/logs","loop_id":"agentmail-replier","provider_route":"shared-agent-runner","state_root":"~/.openclaw"},{"cadence":{"keep_alive":true},"cleanup":{"max_age_days":14,"max_runs":100},"domain":"earn","effect_class":"message","entrypoint":"runtime/agentmail/launch.sh","label":"ai.anicca.agentmail-webhook","log_root":"~/.openclaw/logs","loop_id":"agentmail-webhook","provider_route":"shared-agent-runner","state_root":"~/.openclaw"},{"cadence":{"start_interval_seconds":1800},"cleanup":{"max_age_days":14,"max_runs":100},"domain":"system","effect_class":"none","entrypoint":"skills/self-sync/sync.sh","label":"ai.anicca.agents-skills-sync","log_root":"~/.openclaw/logs","loop_id":"agents-skills-sync","provider_route":"shared-agent-runner","state_root":"~/.openclaw"},{"cadence":{"start_interval_seconds":300},"cleanup":{"max_age_days":14,"max_runs":100},"domain":"financial","effect_class":"trade","entrypoint":"skills/alpaca-investment/run.py","label":"ai.anicca.alpaca-investment","log_root":"~/.local/state/life-manager/alpaca-investment/logs","loop_id":"alpaca-investment","provider_route":"shared-agent-runner","state_root":"~/.local/state/life-manager/alpaca-investment"},{"cadence":{"calendar_interval":{"Hour":22,"Minute":0,"Weekday":0}},"cleanup":{"max_age_days":14,"max_runs":100},"domain":"earn","effect_class":"none","entrypoint":"skills/writer-agent/scripts/audit-7day.sh","label":"ai.anicca.article-audit-7day","log_root":"~/.openclaw/logs","loop_id":"article-audit-7day","provider_route":"shared-agent-runner","state_root":"~/.openclaw"},{"cadence":{"calendar_interval":{"Hour":6,"Minute":0}},"cleanup":{"max_age_days":14,"max_runs":100},"domain":"earn","effect_class":"none","entrypoint":"skills/writer-agent/article-daily.sh","label":"ai.anicca.article-daily","log_root":"~/.openclaw/logs","loop_id":"article-daily","provider_route":"shared-agent-runner","state_root":"~/.openclaw"},{"cadence":{"start_interval_seconds":300},"cleanup":{"max_age_days":14,"max_runs":100},"domain":"earn","effect_class":"none","entrypoint":"skills/writer-agent/article-healthcheck.sh","label":"ai.anicca.article-healthcheck","log_root":"~/.openclaw/logs","loop_id":"article-healthcheck","provider_route":"shared-agent-runner","state_root":"~/.openclaw"},{"cadence":{"calendar_interval":{"Hour":3,"Minute":0,"Weekday":0}},"cleanup":{"max_age_days":14,"max_runs":100},"domain":"earn","effect_class":"none","entrypoint":"skills/writer-agent/scripts/learn-whitelist.sh","label":"ai.anicca.article-learn-whitelist","log_root":"~/.openclaw/logs","loop_id":"article-learn-whitelist","provider_route":"shared-agent-runner","state_root":"~/.openclaw"},{"cadence":{"start_interval_seconds":300},"cleanup":{"max_age_days":14,"max_runs":100},"domain":"earn","effect_class":"none","entrypoint":"skills/writer-agent/scripts/article-resume-pending.sh","label":"ai.anicca.article-resume","log_root":"~/.openclaw/logs","loop_id":"article-resume","provider_route":"shared-agent-runner","state_root":"~/.openclaw"},{"cadence":{"calendar_interval":{"Hour":22,"Minute":30}},"cleanup":{"max_age_days":14,"max_runs":100},"domain":"earn","effect_class":"none","entrypoint":"skills/writer-agent/scripts/self-improve.sh","label":"ai.anicca.article-self-improve","log_root":"~/.openclaw/logs","loop_id":"article-self-improve","provider_route":"shared-agent-runner","state_root":"~/.openclaw"},{"cadence":{"start_interval_seconds":300},"cleanup":{"max_age_days":14,"max_runs":100},"domain":"earn","effect_class":"none","entrypoint":"skills/writer-agent/scripts/zenn-deferred-worker.sh","label":"ai.anicca.article-zenn-retry","log_root":"~/.openclaw/logs","loop_id":"article-zenn-retry","provider_route":"shared-agent-runner","state_root":"~/.openclaw"},{"cadence":{"run_at_load":true},"cleanup":{"max_age_days":30,"max_runs":20},"domain":"system","effect_class":"none","entrypoint":"runtime/host/boot_panic_collector.py","label":"ai.anicca.boot-panic-evidence","log_root":"~/.local/state/life-manager/boot-panic-evidence/logs","loop_id":"boot-panic-evidence","provider_route":"deterministic","state_root":"~/.local/state/life-manager/boot-panic-evidence"},{"cadence":{"start_interval_seconds":300},"cleanup":{"max_age_days":14,"max_runs":100},"domain":"earn","effect_class":"none","entrypoint":"skills/bounty/bounty-healthcheck.sh","label":"ai.anicca.bounty-core-healthcheck","log_root":"~/.openclaw/logs","loop_id":"bounty-core-healthcheck","provider_route":"shared-agent-runner","state_root":"~/.openclaw"},{"cadence":{"start_interval_seconds":86400},"cleanup":{"max_age_days":14,"max_runs":100},"domain":"system","effect_class":"none","entrypoint":"skills/_shared/browser-state-backup.sh","label":"ai.anicca.browser-state-backup","log_root":"~/.openclaw/logs","loop_id":"browser-state-backup","provider_route":"deterministic","state_root":"~/.openclaw"},{"cadence":{"calendar_interval":{"Hour":21,"Minute":5}},"cleanup":{"max_age_days":14,"max_runs":100},"domain":"system","effect_class":"none","entrypoint":"skills/self/cadence-deadline-check.sh","label":"ai.anicca.cadence-deadline-check","log_root":"~/.openclaw/logs","loop_id":"cadence-deadline-check","provider_route":"deterministic","state_root":"~/.openclaw"},{"cadence":{"calendar_interval":{"Hour":9,"Minute":30}},"cleanup":{"max_age_days":14,"max_runs":100},"domain":"growth","effect_class":"none","entrypoint":"skills/earn/capafy-marketing/capafy-goal-monitor.sh","label":"ai.anicca.capafy-goal-monitor","log_root":"~/.local/state/life-manager/logs","loop_id":"capafy-goal-monitor","provider_route":"shared-agent-runner","state_root":"~/.local/state/life-manager"},{"cadence":{"calendar_interval":{"Hour":23,"Minute":50}},"cleanup":{"max_age_days":14,"max_runs":100},"domain":"growth","effect_class":"none","entrypoint":"skills/earn/capafy-marketing/capafy-goal-monitor.sh","label":"ai.anicca.capafy-goal-monitor-daily-close","log_root":"~/.local/state/life-manager/logs","loop_id":"capafy-goal-monitor-daily-close","provider_route":"shared-agent-runner","state_root":"~/.local/state/life-manager"},{"cadence":{"calendar_interval":{"Minute":0}},"cleanup":{"max_age_days":14,"max_runs":100},"domain":"growth","effect_class":"none","entrypoint":"skills/earn/capafy-marketing/capafy-goal-monitor.sh","label":"ai.anicca.capafy-goal-monitor-hourly","log_root":"~/.local/state/life-manager/logs","loop_id":"capafy-goal-monitor-hourly","provider_route":"shar